salmonella outbreak traced to peanut butter,fear
allen and okur get all star call,joy
taliban seize rural district in southwest as police flee,fear
pc world editor slain at california home,sad
israelis retaliate after attack by lebanese army,fear
attack video saddens friendly fire widow,sad
whether to save cord blood can be puzzle for parents,surprise
philippine anti terror law delayed until june,fear
apple s dark secret the claim,surprise
spacewalker sets new u s record,joy
france al qaeda suspects arrested,fear
review nokia xpress music,joy
sleep more to fight childhood obesity,surprise
dead after utah mall shooting rampage,sad
german paper shows soldiers desecrating skull,disgust
japanese whaler afire in antarctic,sad
jet flips in snowstorm none dead,joy
teacher in hiding after attack on islam stirs threats,fear
mistrial for officer who refused to go to iraq,sad
rwanda mulling kid limit for families,joy
man admits uk us terror bomb plot,fear
deaths as bird flu flares in asia,fear
uk characters boosting box office,joy
moscow says palestine israeli contacts key to mideast peace,joy
sony apologizes for battery recall,joy
mass venezuela opposition rally,anger
squirrel jumps boy in park rabies suspected,surprise
